{
  "schemaVersion": 1,
  "id": "ronda-di-notte",
  "order": 3,
  "title": "La ronda di notte",
  "artist": "Rembrandt van Rijn",
  "year": "1642",
  "room": "",
  "experience": "dettagli",
  "demo": true,
  "aspect": 1.1971326164874552,
  "image": "immagine.jpg",
  "depth": "depth.jpg",
  "audio": {
    "src": "audio.opus",
    "fallback": "audio.m4a",
    "durationSec": 126.9
  },
  "subtitles": "subtitles.vtt",
  "alignment": "alignment.json",
  "targets": {
    "mind": "targets.mind",
    "main": {
      "targetIndex": 0,
      "image": "target.jpg",
      "points": 2563
    }
  },
  "dettagli": [
    {
      "id": "capitano",
      "label": "Il capitano",
      "crop": {
        "x": 0.334,
        "y": 0.449,
        "w": 0.218,
        "h": 0.537
      },
      "trigger": [
        "target",
        "reticle"
      ],
      "targetIndex": 1,
      "image": "dettaglio-capitano.jpg",
      "points": 1357,
      "thumb": "mini-capitano.jpg",
      "media": {
        "type": "audio",
        "audioSegment": {
          "from": 34.59,
          "to": 41.3
        }
      },
      "text": "Il capitano Frans Banninck Cocq, vestito di nero con una fascia rossa, tende la mano e dà l'ordine di mettersi in marcia.",
      "source": "testo.txt: \"Il capitano Frans Banninck Cocq, vestito di nero con una fascia rossa, tende la mano e dà …\""
    },
    {
      "id": "luogotenente",
      "label": "Il luogotenente",
      "crop": {
        "x": 0.552,
        "y": 0.486,
        "w": 0.148,
        "h": 0.485
      },
      "trigger": [
        "target",
        "reticle"
      ],
      "targetIndex": 2,
      "image": "dettaglio-luogotenente.jpg",
      "points": 1646,
      "thumb": "mini-luogotenente.jpg",
      "media": {
        "type": "audio",
        "audioSegment": {
          "from": 41.75,
          "to": 47.82
        }
      },
      "text": "Accanto a lui il luogotenente Willem van Ruytenburch, tutto vestito di chiaro, ascolta il comando.",
      "source": "testo.txt: \"Accanto a lui il luogotenente Willem van Ruytenburch, tutto vestito di chiaro, ascolta il …\""
    },
    {
      "id": "bambina",
      "label": "La bambina nella luce",
      "crop": {
        "x": 0.252,
        "y": 0.58,
        "w": 0.122,
        "h": 0.282
      },
      "trigger": [
        "target",
        "reticle"
      ],
      "targetIndex": 3,
      "image": "dettaglio-bambina.jpg",
      "points": 1920,
      "thumb": "mini-bambina.jpg",
      "media": {
        "type": "audio",
        "audioSegment": {
          "from": 72.93,
          "to": 79.12
        }
      },
      "text": "È una bambina vestita d'oro, colpita dalla luce come da un riflettore. Dalla sua cintura pende un pollo morto.",
      "source": "testo.txt: \"È una bambina vestita d'oro, colpita dalla luce come da un riflettore. Dalla sua cintura p…\""
    },
    {
      "id": "moschettiere",
      "label": "L'uomo in rosso",
      "crop": {
        "x": 0.134,
        "y": 0.475,
        "w": 0.144,
        "h": 0.448
      },
      "trigger": [
        "target",
        "reticle"
      ],
      "targetIndex": 4,
      "image": "dettaglio-moschettiere.jpg",
      "points": 878,
      "thumb": "mini-moschettiere.jpg",
      "media": {
        "type": "audio",
        "audioSegment": {
          "from": 64.69,
          "to": 67.86
        }
      },
      "text": "A sinistra, un uomo vestito di rosso maneggia il suo moschetto.",
      "source": "testo.txt: \"A sinistra, un uomo vestito di rosso maneggia il suo moschetto.\""
    },
    {
      "id": "tamburino",
      "label": "Il tamburino",
      "crop": {
        "x": 0.872,
        "y": 0.601,
        "w": 0.128,
        "h": 0.255
      },
      "trigger": [
        "target",
        "reticle"
      ],
      "targetIndex": 5,
      "image": "dettaglio-tamburino.jpg",
      "points": 1701,
      "thumb": "mini-tamburino.jpg",
      "media": {
        "type": "audio",
        "audioSegment": {
          "from": 80.02,
          "to": 87.6
        }
      },
      "text": "A destra, il tamburino batte il suo grande tamburo per dare il ritmo alla marcia. Ai suoi piedi un cane abbaia, spaventato dal rumore.",
      "source": "testo.txt: \"A destra, il tamburino batte il suo grande tamburo per dare il ritmo alla marcia. Ai suoi …\""
    },
    {
      "id": "cane",
      "label": "Il cane",
      "crop": {
        "x": 0.748,
        "y": 0.794,
        "w": 0.131,
        "h": 0.115
      },
      "trigger": [
        "target",
        "reticle"
      ],
      "targetIndex": 6,
      "image": "dettaglio-cane.jpg",
      "points": 1085,
      "thumb": "mini-cane.jpg",
      "media": {
        "type": "audio",
        "audioSegment": {
          "from": 84.63,
          "to": 87.6
        }
      },
      "text": "Ai suoi piedi un cane abbaia, spaventato dal rumore.",
      "source": "testo.txt: \"Ai suoi piedi un cane abbaia, spaventato dal rumore.\""
    },
    {
      "id": "scudo",
      "label": "Lo scudo con i nomi",
      "crop": {
        "x": 0.526,
        "y": 0.074,
        "w": 0.148,
        "h": 0.229
      },
      "trigger": [
        "target",
        "reticle"
      ],
      "targetIndex": 7,
      "image": "dettaglio-scudo.jpg",
      "points": 682,
      "thumb": "mini-scudo.jpg",
      "media": {
        "type": "audio",
        "audioSegment": {
          "from": 91.86,
          "to": 98.01
        }
      },
      "text": "Accanto all'arco c'è uno scudo con i nomi di molti degli uomini ritratti: è il modo in cui ancora oggi sappiamo chi sono.",
      "source": "testo.txt: \"Accanto all'arco c'è uno scudo con i nomi di molti degli uomini ritratti: è il modo in cui…\""
    }
  ],
  "racconto": {
    "auto": true,
    "timeline": [
      {
        "t": 0,
        "action": "cameraTo",
        "args": {
          "rect": {
            "x": 0,
            "y": 0,
            "w": 1,
            "h": 1
          },
          "label": ""
        },
        "source": "inizio"
      },
      {
        "t": 34.29,
        "action": "cameraTo",
        "args": {
          "rect": {
            "x": 0.334,
            "y": 0.449,
            "w": 0.218,
            "h": 0.537
          },
          "label": "Il capitano",
          "id": "capitano"
        },
        "source": "ancora: \"Il capitano Frans Banninck Cocq\""
      },
      {
        "t": 41.45,
        "action": "cameraTo",
        "args": {
          "rect": {
            "x": 0.552,
            "y": 0.486,
            "w": 0.148,
            "h": 0.485
          },
          "label": "Il luogotenente",
          "id": "luogotenente"
        },
        "source": "ancora: \"Accanto a lui il luogotenente\""
      },
      {
        "t": 64.95,
        "action": "cameraTo",
        "args": {
          "rect": {
            "x": 0.134,
            "y": 0.475,
            "w": 0.144,
            "h": 0.448
          },
          "label": "L'uomo in rosso",
          "id": "moschettiere"
        },
        "source": "ancora: \"un uomo vestito di rosso\""
      },
      {
        "t": 72.63,
        "action": "cameraTo",
        "args": {
          "rect": {
            "x": 0.252,
            "y": 0.58,
            "w": 0.122,
            "h": 0.282
          },
          "label": "La bambina nella luce",
          "id": "bambina"
        },
        "source": "ancora: \"È una bambina vestita d'oro\""
      },
      {
        "t": 80.19,
        "action": "cameraTo",
        "args": {
          "rect": {
            "x": 0.872,
            "y": 0.601,
            "w": 0.128,
            "h": 0.255
          },
          "label": "Il tamburino",
          "id": "tamburino"
        },
        "source": "ancora: \"il tamburino batte il suo grande tamburo\""
      },
      {
        "t": 84.33,
        "action": "cameraTo",
        "args": {
          "rect": {
            "x": 0.748,
            "y": 0.794,
            "w": 0.131,
            "h": 0.115
          },
          "label": "Il cane",
          "id": "cane"
        },
        "source": "ancora: \"Ai suoi piedi un cane abbaia\""
      },
      {
        "t": 92.43,
        "action": "cameraTo",
        "args": {
          "rect": {
            "x": 0.526,
            "y": 0.074,
            "w": 0.148,
            "h": 0.229
          },
          "label": "Lo scudo con i nomi",
          "id": "scudo"
        },
        "source": "ancora: \"c'è uno scudo con i nomi\""
      }
    ]
  },
  "budget": {
    "bytes": 5533731,
    "limit": 6291456
  }
}